{
  "title": "Happier Than Ever",
  "artist": "Billie Eilish",
  "difficulty": "intermediate",
  "tuning": "E A D G B E",
  "capo": "",
  "key": "C",
  "chords_required": [
    "Am",
    "Am/E",
    "Am/G",
    "C",
    "C/G",
    "Cadd9",
    "D/F#",
    "Dm7",
    "E7",
    "F",
    "Fm",
    "G",
    "G6",
    "G7"
  ],
  "content": [
    {
      "section": "Intro - Rhythm Guitar",
      "lines": [
        {
          "chords": [
            {
              "chord": "G",
              "position": 4
            },
            {
              "chord": "G6",
              "position": 26
            },
            {
              "chord": "G7",
              "position": 35
            }
          ],
          "lyrics": "e|-------3---3----3---3---0----|---1-------------|"
        },
        {
          "chords": [],
          "lyrics": "B|-------0---0----0---0---0----|---0-------------|"
        },
        {
          "chords": [],
          "lyrics": "G|-------0---0----0---0---0----|---0-------------|"
        },
        {
          "chords": [],
          "lyrics": "D|-----------------------------|---0-------------|"
        },
        {
          "chords": [],
          "lyrics": "A|-----------------------------|-----------------|"
        },
        {
          "chords": [],
          "lyrics": "E|---3-------------------------|-----------------|"
        },
        {
          "chords": [],
          "lyrics": "Billie Eilish"
        },
        {
          "chords": [],
          "lyrics": "https://www.youtube.com/watch?v=NSTUVHsb9xw."
        },
        {
          "chords": [
            {
              "chord": "E7",
              "position": 5
            },
            {
              "chord": "Am",
              "position": 6
            },
            {
              "chord": "Am/E",
              "position": 6
            },
            {
              "chord": "Cadd9",
              "position": 6
            }
          ],
          "lyrics": "80 bpm"
        },
        {
          "chords": [],
          "lyrics": "to play, feel free to use a regular C"
        },
        {
          "chords": [],
          "lyrics": "[Verse 1 - Full Picking Pattern (With Optional"
        },
        {
          "chords": [
            {
              "chord": "C",
              "position": 4
            },
            {
              "chord": "C/G",
              "position": 14
            },
            {
              "chord": "C",
              "position": 31
            }
          ],
          "lyrics": "e|-------0--0-------0--0---|-------0--0--------0--0---|"
        },
        {
          "chords": [],
          "lyrics": "B|-------1--1-------1--1---|-------1--1--------1--1---|"
        },
        {
          "chords": [],
          "lyrics": "G|-------0--0-------0--0---|-------0--0--------0--0---|"
        },
        {
          "chords": [],
          "lyrics": "D|-------2--2-------2--2---|-------2--2--------2--2---|"
        },
        {
          "chords": [],
          "lyrics": "A|---3---------------------|---3----------------------|"
        },
        {
          "chords": [],
          "lyrics": "E|---------------3---------|---------------3----------|"
        },
        {
          "chords": [
            {
              "chord": "E7",
              "position": 3
            }
          ],
          "lyrics": "e|-------0--0-------0--0---|-------0--0--------0--0---|"
        },
        {
          "chords": [],
          "lyrics": "B|-------0--0-------0--0---|-------0--0--------0--0---|"
        },
        {
          "chords": [],
          "lyrics": "G|-------1--1-------1--1---|-------1--1--------1--1---|"
        },
        {
          "chords": [],
          "lyrics": "D|-------0--0-------0--0---|-------0--0--------0--0---|"
        },
        {
          "chords": [],
          "lyrics": "A|---2---------------------|---2----------------------|"
        },
        {
          "chords": [],
          "lyrics": "E|---------------0---------|---------------0----------|"
        },
        {
          "chords": [
            {
              "chord": "Am",
              "position": 3
            },
            {
              "chord": "Am/E",
              "position": 14
            },
            {
              "chord": "Am",
              "position": 30
            }
          ],
          "lyrics": "e|-------0--0-------0--0---|-------0--0--------0--0---|"
        },
        {
          "chords": [],
          "lyrics": "B|-------1--1-------1--1---|-------1--1--------1--1---|"
        },
        {
          "chords": [],
          "lyrics": "G|-------2--2-------2--2---|-------2--2--------2--2---|"
        },
        {
          "chords": [],
          "lyrics": "D|-------2--2-------2--2---|-------2--2--------2--2---|"
        },
        {
          "chords": [],
          "lyrics": "A|---0---------------------|---0----------------------|"
        },
        {
          "chords": [],
          "lyrics": "E|---------------0---------|---------------0----------|"
        },
        {
          "chords": [],
          "lyrics": "Dm7b5"
        },
        {
          "chords": [],
          "lyrics": "e|-------1--1-------1--1---|-------1--1--------1--1---|"
        },
        {
          "chords": [],
          "lyrics": "B|-------1--1-------1--1---|-------1--1--------1--1---|"
        },
        {
          "chords": [],
          "lyrics": "G|-------1--1-------1--1---|-------1--1--------1--1---|"
        },
        {
          "chords": [],
          "lyrics": "D|---0-----------0---------|---0-----------0----------|"
        },
        {
          "chords": [],
          "lyrics": "A|-------------------------|--------------------------|"
        },
        {
          "chords": [],
          "lyrics": "E|-------------------------|--------------------------|"
        }
      ]
    },
    {
      "section": "Chorus",
      "lines": [
        {
          "chords": [
            {
              "chord": "Cadd9",
              "position": 9
            }
          ],
          "lyrics": "When I'm away from you"
        },
        {
          "chords": [
            {
              "chord": "E7",
              "position": 17
            }
          ],
          "lyrics": "I'm happier than ever"
        },
        {
          "chords": [
            {
              "chord": "Am",
              "position": 24
            }
          ],
          "lyrics": "Wish I could explain it better"
        },
        {
          "chords": [
            {
              "chord": "Dm7",
              "position": 17
            },
            {
              "chord": "G",
              "position": 23
            }
          ],
          "lyrics": "I wish it wasn't true, mmm"
        },
        {
          "chords": [
            {
              "chord": "Cadd9",
              "position": 8
            }
          ],
          "lyrics": "Give me a day or two"
        },
        {
          "chords": [
            {
              "chord": "E7",
              "position": 22
            }
          ],
          "lyrics": "To think of something clever"
        },
        {
          "chords": [
            {
              "chord": "Am",
              "position": 16
            }
          ],
          "lyrics": "To write myself a letter"
        },
        {
          "chords": [
            {
              "chord": "Dm7",
              "position": 18
            },
            {
              "chord": "G",
              "position": 22
            }
          ],
          "lyrics": "To tell me what to do, mm-mm"
        },
        {
          "chords": [],
          "lyrics": "Slash Chords)]"
        },
        {
          "chords": [
            {
              "chord": "C/G",
              "position": 0
            }
          ],
          "lyrics": ""
        },
        {
          "chords": [
            {
              "chord": "Am/E",
              "position": 0
            }
          ],
          "lyrics": ""
        }
      ]
    },
    {
      "section": "Verse 1",
      "lines": [
        {
          "chords": [
            {
              "chord": "C",
              "position": 0
            }
          ],
          "lyrics": "Do you read my interviews?"
        },
        {
          "chords": [
            {
              "chord": "E7",
              "position": 3
            }
          ],
          "lyrics": "Or do you skip my avenue?"
        },
        {
          "chords": [
            {
              "chord": "Am",
              "position": 5
            }
          ],
          "lyrics": "When you said you were passin' through"
        },
        {
          "chords": [],
          "lyrics": "Dm7b5"
        },
        {
          "chords": [],
          "lyrics": "Was I even on your way?"
        },
        {
          "chords": [
            {
              "chord": "C",
              "position": 2
            }
          ],
          "lyrics": "I knew when I asked you to (When I asked"
        },
        {
          "chords": [
            {
              "chord": "E7",
              "position": 3
            }
          ],
          "lyrics": "Be cool about what I was tellin' you"
        },
        {
          "chords": [
            {
              "chord": "Am",
              "position": 6
            }
          ],
          "lyrics": "You'd do the opposite of what you said you'd"
        },
        {
          "chords": [],
          "lyrics": "Dm7b5"
        },
        {
          "chords": [],
          "lyrics": "And I'd end up more afraid"
        },
        {
          "chords": [
            {
              "chord": "E7",
              "position": 14
            }
          ],
          "lyrics": "Don't say it isn't fair"
        },
        {
          "chords": [
            {
              "chord": "Am",
              "position": 35
            }
          ],